{
  "input_version": 1,
  "work_status": "active",
  "capture": {
    "completeness": "complete",
    "warnings": [],
    "omitted_sections": []
  },
  "context": {
    "title": "ctx 캡처 입력 계약 정의",
    "summary": "스킬이 의미 컨텍스트만 제공하고 CLI가 체크포인트의 기계적 필드를 채우는 입력 경계를 정의한다.",
    "objective": {
      "goal": "Claude Code와 Codex 스킬이 같은 형식으로 체크포인트 생성을 요청할 수 있게 한다.",
      "success_criteria": [
        "입력에는 대화에서 추출한 의미 상태만 들어간다.",
        "작업 ID, Git 상태와 해시는 CLI가 입력과 독립적으로 생성한다."
      ],
      "scope": {
        "in_scope": [
          "작업 상태, 캡처 완전성, 자체 완결형 의미 컨텍스트"
        ],
        "out_of_scope": [
          "체크포인트 ID, 부모, 생성 시각, Git 기준점과 콘텐츠 해시"
        ]
      }
    },
    "constraints": [],
    "assumptions": [],
    "findings": [],
    "decisions": [
      {
        "decision_id": "decision-capture-boundary",
        "statement": "스킬 입력과 저장 체크포인트를 서로 다른 계약으로 관리한다.",
        "rationale": "에이전트가 기계적으로 수집하거나 생성해야 하는 값을 추측하지 않게 한다.",
        "status": "accepted",
        "alternatives": [
          "스킬이 완성된 체크포인트 레코드를 생성한다."
        ],
        "consequences": [
          "CLI가 입력 검증과 체크포인트 조립을 책임진다."
        ],
        "supersedes": [],
        "evidence_refs": []
      }
    ],
    "progress": {
      "completed": [
        {
          "summary": "저장 체크포인트의 v1 스키마를 정의했다.",
          "result": "체크포인트 정본의 필드와 불변식이 정해졌다.",
          "resource_refs": [
            "resource-capture-schema"
          ],
          "evidence_refs": []
        }
      ],
      "current": [
        {
          "summary": "캡처 입력 스키마와 예제를 검증하고 있다.",
          "current_state": "스킬과 CLI의 책임 경계를 스키마로 표현한 상태다.",
          "resource_refs": [
            "resource-capture-schema"
          ],
          "evidence_refs": []
        }
      ]
    },
    "next_actions": [
      {
        "action_id": "action-implement-go-input",
        "description": "Go CLI에서 캡처 입력을 읽고 검증하는 경계를 구현한다.",
        "priority": "high",
        "done_when": "유효한 입력을 받아 체크포인트 조립 단계로 전달하고 잘못된 입력을 거부한다.",
        "dependencies": [],
        "resource_refs": [
          "resource-capture-schema"
        ],
        "evidence_refs": []
      }
    ],
    "blockers": [],
    "open_questions": [],
    "validations": [],
    "relevant_resources": [
      {
        "resource_id": "resource-capture-schema",
        "locator": {
          "kind": "repo_path",
          "repo_id": "ai-kit-local",
          "path": "schemas/v1/capture-input.schema.json"
        },
        "relation": "created",
        "role": "specification",
        "note": "스킬이 checkpoint와 handoff 명령에 전달하는 의미 입력을 정의한다.",
        "media_type": "application/schema+json",
        "format": "json-schema",
        "extensions": {}
      }
    ]
  }
}
